alloy_id,canonical_name,aliases,family,analogue_recipe_class,evidence_class,source_priority,spec_ids,nominal_composition_text,composition_elements,composition_vector_json,base_element,major_additions,product_forms,route_tags,am_supported,preferred_recipe_template,heat_treatment_summary,joining_fabrication_notes,operating_temperature_band,application_notes,known_watch_outs,match_guardrails,provenance_note,source_url_or_ref
ni_in718,INCONEL alloy 718,IN718; Alloy 718,Ni-based,named_analogue,manufacturer+am,1,UNS N07718; AMS 5662; AMS 5664; W.Nr 2.4668; DIN NiCr19Fe19NbMo3,"Ni 50-55, Cr 17-21, Fe balance, Nb+Ta 4.75-5.50, Mo 2.80-3.30, Ti 0.65-1.15, Al 0.20-0.80",Ni;Cr;Fe;Nb;Mo;Ti;Al,"{""Ni"": ""50-55"", ""Cr"": ""17-21"", ""Fe"": ""balance"", ""Nb+Ta"": ""4.75-5.50"", ""Mo"": ""2.80-3.30"", ""Ti"": ""0.65-1.15"", ""Al"": ""0.20-0.80""}",Ni,Cr;Nb;Mo;Ti;Al,wrought; sheet; rings; casings; fasteners; powder,wrought; forging; welding; LPBF/DMLS,yes,ni_am_age_hardened,"Solution treat 1850-1900F, then age at 1450F for 6-8 h and air cool; AM parts are precipitation hardened after build.","Good weldability and resistance to post-weld cracking; AM parts can be machined, welded, shot-peened, polished and coated.",Cryogenic service noted; EOS AM sheet highlights good tensile/fatigue/creep/rupture strength up to ~700C / 1290F.,Gas turbine components; instrumentation parts; rocket and power-industry parts.,Requires precipitation hardening; manage distortion/cracking risk in AM builds and post-build heat treatment.,Do not use when Co is dominant or when chemistry drifts strongly toward corrosion-first Ni-Mo alloys rather than age-hardened Ni superalloys.,Special Metals bulletin + EOS AM data sheet,https://www.specialmetals.com/documents/technical-bulletins/inconel/inconel-alloy-718.pdf; https://www.eos.info/metal-solutions/metal-materials/data-sheets/mds-eos-nickelalloy-in718
ni_in625,INCONEL alloy 625,IN625; Alloy 625,Ni-based,named_analogue,manufacturer,1,UNS N06625; W.Nr 2.4856,"Ni 58 min, Cr 20-23, Mo 8-10, Nb+Ta 3.15-4.15, Fe max 5",Ni;Cr;Mo;Nb;Fe,"{""Ni"": ""58 min"", ""Cr"": ""20-23"", ""Mo"": ""8.0-10.0"", ""Nb+Ta"": ""3.15-4.15"", ""Fe"": ""0-5""}",Ni,Cr;Mo;Nb;Fe,wrought; plate; welded fabrications; corrosion-service components,wrought; welding,limited,ni_wrought_solid_solution,Strength comes from Mo and Nb in the Ni-Cr matrix; precipitation-hardening treatments are not required.,Excellent fabricability including joining; filler metals based on 625 are used without post-weld heat treatment to maintain strength and ductility.,Service temperatures from cryogenic to about 1800F / 982C are noted in the bulletin.,Sea-water and severe-corrosion service; high-strength ductile welded fabrications.,Usually a corrosion/service analogue rather than the best creep-first hot-section analogue; avoid over-claiming AM route support from this starter row.,Do not force-match to gamma-prime-style age-hardened Ni-superalloy candidates where IN718/282-like logic is a better fit.,Special Metals bulletin,https://www.specialmetals.com/documents/technical-bulletins/inconel/inconel-alloy-625.pdf
ni_h282,HAYNES 282 alloy,282; HAYNES 282,Ni-based,named_analogue,manufacturer+am,1,UNS N07208,"Ni balance, Cr 20, Co 10, Mo 8.5, Ti 2.1, Al 1.5, Fe max 1.5",Ni;Cr;Co;Mo;Ti;Al;Fe,"{""Ni"": ""balance"", ""Cr"": ""20"", ""Co"": ""10"", ""Mo"": ""8.5"", ""Ti"": ""2.1"", ""Al"": ""1.5"", ""Fe"": ""0-1.5""}",Ni,Cr;Co;Mo;Ti;Al,sheet; plate; rings; closed-die forgings; bar; heavy plate blanks; powder,wrought; forging; welding; LPBF/DMLS,yes,ni_am_or_wrought_age_hardened,Typical solution anneal 2050-2100F; standard age-hardening treatment 1850F / 2 h / AC + 1450F / 8 h / AC. EOS notes as-built parts need solution + aging to develop high-temperature strength.,Designed for strong fabricability and weldability relative to creep-capable superalloys; AM feedstock exists for EOS DMLS.,"Haynes positions it for high-temperature structural use; EOS positions it for aerospace, rocket engine, turbomachinery and gas-turbine parts.",Combustors; turbine and exhaust sections; nozzle components; rocket engine and gas turbine parts.,Do not treat as a no-heat-treatment alloy; high-temperature strength depends on proper solution + age route.,Do not use when the candidate lacks a Ni base or when chemistry is much closer to corrosion-first Ni-Mo systems than precipitation-strengthened superalloys.,Haynes brochure + EOS AM data sheet,https://haynesintl.com/wp-content/uploads/2023/09/282-brochure.pdf; https://www.eos.info/metal-solutions/metal-materials/data-sheets/mds-eos-nickelalloy-haynes-282
ti_ti64_g5,Ti-6Al-4V Grade 5,Ti64 G5; Ti64 Grade 5,Ti-based,named_analogue,manufacturer+am,1,UNS R56400; AMS 4928; AMS 4965; AMS 4967; ASTM B348; ASTM F1472; ASTM F2924; ASTM F3302,"Ti balance, Al 5.5-6.75, V 3.5-4.5 (Grade 5 Ti6Al4V chemistry class)",Ti;Al;V;Fe;O,"{""Ti"": ""balance"", ""Al"": ""5.5-6.75"", ""V"": ""3.5-4.5"", ""Fe"": ""0-0.3"", ""O"": ""0-0.2""}",Ti,Al;V,bars; forgings; forging stock; powder,wrought; forging; heat_treat; LPBF/DMLS,yes,ti_am_or_wrought_stress_relief,"Anneal 1275-1400F for 0.5-2 h; stress relieve 1000-1200F for 1-8 h; solution treat 1675-1750F for 1 h, water quench; age 975-1025F for 4-8 h. EOS recommends heat treatment to reduce internal stresses and increase ductility.","Most widely used titanium grade; AM parts can be machined, shot-peened and polished; forging and wrought routes are standard.",Used from cryogenic temperatures to about 800F / 427C in the ATI sheet; lightweight aerospace structural alloy.,"Compressor blades, discs and rings; airframe components; pressure vessels; rocket engine cases; rotor hubs; fasteners.",AM parts are anisotropic and generally need stress-relief / post-treatment; control oxygen/nitrogen/hydrogen pickup during processing.,Do not use for Ni/Co hot-section analogues just because high strength is needed; this is a lightweight Ti structural analogue.,ATI wrought data sheet + EOS AM data sheet,https://www.atimaterials.com/Products/Documents/datasheets/titanium/alloyed/ati_6-4_tds_en_v1.pdf; https://www.eos.info/metal-solutions/metal-materials/data-sheets/mds-eos-titanium-ti64-grade-5
ti_ti64_g23,Ti-6Al-4V ELI Grade 23,Ti64 ELI; Grade 23,Ti-based,named_analogue,manufacturer+am,1,AMS 4930; AMS 4931; AMS 4996; ASTM F136; ASTM F3001; ASTM F3302,"Ti-6Al-4V ELI class; same Ti/Al/V family as Ti64 with lower oxygen, carbon and iron than standard Grade 5",Ti;Al;V;Fe;O;C,"{""Ti"": ""balance"", ""Al"": ""Ti-6Al-4V class"", ""V"": ""Ti-6Al-4V class"", ""interstitials"": ""ELI / lower O,C,Fe than Grade 5""}",Ti,Al;V,bar; wire; billet; rings; powder,wrought; forging; heat_treat; LPBF/DMLS; HIP,yes,ti_eli_am_or_wrought_hip_ready,"Normally used annealed in ATI sheet: anneal 1300-1350F for 1-8 h, air cool; stress relieve 900-1200F for 1-4 h. EOS Grade 23 positioning supports HIP-centric AM users.",Higher-purity Ti64 variant with better formability and weld toughness than standard Grade 5; inert-gas protection is needed in fusion welding.,Preferred for some cryogenic and aerospace uses; EOS Grade 23 positioning supports additive workflows where HIP is a standard post-treatment.,Cryogenic-capable aerospace components; high-toughness Ti64 ELI use cases; medical and marine/cryogenic overlap exists in source literature.,Keep recipe claims cautious unless route/source is explicitly Grade 23-backed; preserve low-interstitial processing discipline.,Do not force-match to standard Grade 5 if toughness / low-interstitial behavior is the real reason the candidate is attractive; keep ELI as a distinct analogue.,ATI Grade 23 sheet + EOS Grade 23 AM sheet,https://www.atimaterials.com/Products/Documents/datasheets/titanium/alloyed/ati_6-4eli_tds_en_v1.pdf; https://www.eos.info/03_system-related-assets/material-related-contents/metal-materials-and-examples/metal-material-datasheet/titan/ti64/material_datasheet_eos_titanium_ti64_grade23_premium_en_web.pdf
co_h188,HAYNES 188 alloy,188; Haynes 188,Co-based,named_analogue,manufacturer,1,UNS R30188; AMS 5608,"Co balance, Ni 22, Cr 22, W 14, Fe max 3, La 0.03",Co;Ni;Cr;W;Fe;La,"{""Co"": ""balance"", ""Ni"": ""22"", ""Cr"": ""22"", ""W"": ""14"", ""Fe"": ""0-3"", ""La"": ""0.03""}",Co,Ni;Cr;W,sheet; plate; fabricated hot-section components,wrought; forming; welding; solution_heat_treat,no,co_wrought_solution_annealed,Usually furnished solution heat treated; normally 2125-2175F and rapidly cooled or water quenched for optimal properties.,Readily fabricated and formed by conventional techniques; good forming and welding characteristics are highlighted by Haynes.,Very good oxidation resistance for prolonged exposures up to 2000F / 1095C is highlighted in the brochure.,Combustion cans; transition ducts; afterburner components; other aerospace gas-turbine hot-section fabrications.,High Co/W burden will likely worsen sustainability and supply-risk scores; use conventional-fabrication route logic unless trusted AM evidence is added later.,Do not use as a Ni-superalloy analogue just because Ni is present; keep Co-dominant chemistry as the decisive family cue.,Haynes brochure,https://haynesintl.com/wp-content/uploads/2024/08/188-brochure.pdf
ref_tzm,TZM alloy,TZM; titanium-zirconium-molybdenum,Refractory,named_analogue,specialist,1,TZM refractory Mo alloy,"Mo base with about 0.5% Ti, 0.08% Zr and 0.01-0.04% C",Mo;Ti;Zr;C,"{""Mo"": ""balance"", ""Ti"": ""0.5"", ""Zr"": ""0.08"", ""C"": ""0.01-0.04""}",Mo,Ti;Zr;C,rods; plates/sheet; refractory components,powder_metallurgy; wrought_refractory; machining,limited,refractory_mo_pm_or_wrought,Use specialist refractory processing logic rather than generic superalloy heat-treatment windows; treat as a powder-metallurgy / refractory-working analogue in v1.,Plansee positions TZM as stronger and harder than pure molybdenum over a wide temperature range due to fine carbide additions.,High-temperature refractory use; use as a refractory-family anchor rather than as a direct aircraft-certified alloy recipe source.,Refractory high-temperature tooling and hot-zone style anchor; useful as a Mo-Ti-Zr refractory analogue.,Avoid over-claiming aerospace certification or AM readiness from this starter row; oxidation/protective-environment logic needs specialist treatment.,Do not use when Ni/Co-based hot-section fabrication logic is required; this row is for refractory-family matching and specialist route generation.,Plansee alloy page/search-backed specialist reference,https://www.plansee.com/en/materials/molybdenum/alloys.html
ref_c103,C-103 niobium alloy,C103; Nb-10Hf-1Ti,Refractory,named_analogue,specialist+am,1,ASTM B652; ASTM B654; ASTM B655,Nb-10Hf-1Ti refractory alloy (niobium base with hafnium and titanium),Nb;Hf;Ti,"{""Nb"": ""balance"", ""Hf"": ""10"", ""Ti"": ""1""}",Nb,Hf;Ti,sheet; rod; wire; powder/AM study context,wrought; welding; LPBF; HIP; coating,yes,refractory_nb_wrought_or_lpbf_coated,"Starter row does not fix a single certified heat-treatment window; Elmet AM paper discusses LPBF parts followed by HIP, coating and further heat treatment to simulate service conditions.",Materion highlights good weldability and product availability in sheet/rod/wire; Elmet shows LPBF feasibility for C103 in an aerospace context.,Elmet notes historic space-propulsion use around operating temperatures near 1300C for thruster-nozzle environments.,Rocket nozzles; satellites; launch vehicles; jet-engine afterburner flap sections; high-temperature aerospace components.,High-temperature oxidizing service typically needs a protective coating such as R512E; HIP/coating can reduce AM strength versus wrought specifications.,Do not treat as a generic Mo- or W-based refractory analogue; keep Nb-Hf-Ti chemistry and coating need explicit in recipe generation.,Materion product page + Elmet AM paper,https://www.materion.com/en/products/performance-materials/high-performance-alloys/niobium-c-103-alloy; https://www.elmettechnologies.com/manufacturing/nb-c103-l-pbf/
